0	Fulton	2012	In 1989 the building was heavily damaged by fire, but it has since been restored.
1	Bowman	2049	Atoms can contain any character if they are enclosed within single quotes and an escape convention exists which allows any character to be used within an atom.
2	Jensen	2006	The sequential subset of Erlang supports eager evaluation, single assignment, and dynamic typing.
3	Chang	2026	Atoms can contain any character if they are enclosed within single quotes and an escape convention exists which allows any character to be used within an atom.
4	Mcdowell	2048	Erlang is a general-purpose, concurrent, functional programming language.
5	Stark	2020	Type classes first appeared in the Haskell programming language.
6	Meyer	2027	She spent her earliest years reading classic literature, and writing poetry.
7	Hendrix	1990	The sequential subset of Erlang supports eager evaluation, single assignment, and dynamic typing.
8	Santiago	2037	Any element of a tuple can be accessed in constant time.
